{
  "access": {
    "artifact": "data/projects.csv",
    "authentication": "required_admin",
    "cadence": "administrator-triggered",
    "endpoint": null
  },
  "contract_version": "1.0",
  "coverage": "Rows accepted through SORA's administrator-only training-data endpoints",
  "fallback_policy": "No inferred substitute is added when an operator-supplied row is absent or rejected.",
  "fields": [
    {
      "name": "budget",
      "nullable": false,
      "provenance_status": "unknown",
      "type": "number",
      "unit": "current USD"
    },
    {
      "name": "co2_reduction",
      "nullable": false,
      "provenance_status": "unknown",
      "type": "number",
      "unit": "tonnes CO2e/year"
    },
    {
      "name": "social_impact",
      "nullable": false,
      "provenance_status": "unknown",
      "type": "number",
      "unit": "pipeline scale"
    },
    {
      "name": "duration_months",
      "nullable": false,
      "provenance_status": "unknown",
      "type": "number",
      "unit": "months"
    },
    {
      "name": "success",
      "nullable": false,
      "provenance_status": "unknown",
      "type": "integer",
      "unit": "binary"
    }
  ],
  "identity": {
    "deduplication_key": [
      "content_sha256"
    ],
    "required_fields": [
      "content_sha256"
    ]
  },
  "maintainer": "SORA.Earth",
  "measurement_kind": "operator_submitted",
  "missing_value_policy": "Reject rows missing a required training column; preserve accepted values verbatim in the immutable snapshot.",
  "parser": {
    "module": "app.api.retrain",
    "version_source": "git_sha"
  },
  "publisher": "SORA.Earth authenticated administrator",
  "rights": {
    "attribution_required": null,
    "license_id": null,
    "notes": "The operator is responsible for submitting data they are permitted to use; SORA records the accepted bytes and does not infer publisher rights.",
    "terms_url": null,
    "verification_status": "unverified",
    "verified_on": null
  },
  "source_id": "operator_training_data",
  "status": "active",
  "temporal": {
    "frequency": "on accepted administrator submission",
    "freshness_axis": "not_configured",
    "kinds": [
      "not_applicable"
    ],
    "max_vintage_hours": null
  }
}
